id,sentence,queryId,correct,
DACT/wik_part0758/1865354-5-4.xml,Bij verdere afkoeling zal waterdamp die niet meer kan worden opgenomen gaan rijpen en zullen tegen de ruit ijskristallen worden gevormd .,^q_1_pos,0,
DACT/wik_part0758/1865628-9-5.xml,De zes versregels die vertellen dat de Cid Granada op de moslims veroverd zou hebben zijn gefantaseerd .,^q_1_pos,0,
DACT/wik_part0760/1874293-9-4.xml,Omdat hij de kopie die hem gevangen wilde nemen gedood had beseft hij dat sommige cylons nu een menselijk uiterlijk hebben .,^q_1_pos,0,
DACT/wik_part0768/1903023-7-1.xml,De vroegste geluidschips hadden slechts simpele toon- en ruisgenerators met weinig kanalen beschikbaar waardoor zowel de complexiteit van een lied alsook het aantal noten dat tegelijkertijd afgespeeld kon worden beperkt was .,^q_1_pos,0,
DACT/wik_part0772/1921305-24-1.xml,"Zijn latere opvolger en historicus van de stadsbibliotheek Jan Vandamme , gaf in 1970 het volgende waardeoordeel : "" Het werk dat hij gedaan heeft moest gedaan worden en is schitterend gedaan .",^q_1_pos,0,
DACT/wik_part0773/1924979-16-5.xml,"Het kraken van een niet bij B&amp;W geregistreerd leegstaand pand zou niet strafbaar zijn , maar als het pand wel zou zijn geregistreerd was kraken wel strafbaar .",^q_1_pos,0,
DACT/wik_part0775/1929302-3-3.xml,"Omdat hij dat paspoort evengoed van een familielid met de zelfde naam die vroeger geboren is kan hebben overgenomen , weigeren velen om zijn hoge leeftijd te accepteren .",^q_1_pos,0,
DACT/wik_part0776/1933906-8-2.xml,Indien een voeding maximaal 100W kan leveren kan getest worden hoe de voeding zich zal gedragen als deze 24 uur op deze belasting moet functioneren .,^q_1_pos,0,
DACT/wik_part0780/1946729-13-6.xml,Als Wendy eten wil gaan halen komt hij tevoorschijn en valt hij haar aan .,^q_1_pos,0,
DACT/wik_part0783/1957300-14-3.xml,Gezien de diverse onderzoeken die over de hele wereld momenteel gedaan worden kan aangenomen worden dat personen met MTrP's overal ter wereld te vinden zijn .,^q_1_pos,0,
DACT/wik_part0788/1975191-6-3.xml,Toen wederom werd gevraagd om toestemming om de medaille aan te nemen reageerde het Pentagon met de opmerking dat geen sprake was geweest van een binnengekomen Koreaans verzoek en dat een dergelijk verzoek dan ook nog niet beoordeeld had kunnen worden worden .,^q_1_pos,1,
DACT/wik_part0799/2009111-3-3.xml,Zijn mening dat de veerdiensten in de toekomst niet meer zonder overheidssteun zouden kunnen blijven varen werd gedeeld door enkele veerexploitanten langs de rivieren de Rijn en Lek .,^q_1_pos,0,
DACT/wik_part0804/2030404-3-7.xml,"Het document bepaalt dat degenen die van deze misdaden worden verdacht moeten worden berecht door diocesane rechtbanken , onder verantwoordelijkheid van het Heilig Officie .",^q_1_pos,0,
DACT/wik_part0805/2033048-5-3.xml,Na contact met de kakkerlak kan voedsel dat als vers wordt beschouwd besmet zijn geraakt met verschillende ziekteverwekkers .,^q_1_pos,0,
DACT/wik_part0807/2039478-5-3.xml,De kaart bevat een uniek MAC-adres zodat de node waarin de kaart is ingebouwd geïdentificeerd kan worden binnen het draadloos netwerk .,^q_1_pos,0,
DACT/wik_part0809/2054312-6-3.xml,Het reciteren zou opgevat kunnen worden als een muzikaal stijlmiddel om de onbestemdheid van de hoofdpersoon uit te drukken .,^q_1_pos,0,
DACT/wik_part0811/2060588-27-1.xml,Toen men alle nog in leven zijnde veteranen met de Orde van de Patriottische Oorlog wilde gaan onderscheiden moest worden vastgesteld wie veteraan in de zin van het Besluit van het Praesidium was en wie recht zou hebben op de Ie Klasse van de Orde van de Patriottische Oorlog .,^q_1_pos,0,
DACT/wik_part0821/2097305-25-3.xml,"Alleen de voorwerpen die direct met scheepsbouw te maken hebben konden worden opgenomen en omdat er ook van dezelfde objecten meerdere waren bewaard , werd een kerncollectie geselecteerd en opgenomen in de collectie van het museum .",^q_1_pos,0,
DACT/wik_part0822/2100234-4-1.xml,André Claveau was geselecteerd door Franse omroep om zijn land te vertegenwoordigen het lied dat hij zou gaan zingen werd gekozen door een nationale finale aan het winnende lied is bekend gemaakt .,^q_1_pos,0,
DACT/wik_part0824/2106754-4-16.xml,"Als ze de tanker vinden die aangevallen zou moeten worden surft Yoko er naar toe en weet aan boord te komen . de kapitein is niet overtuigd , maar een Japans ingenieur aan boord weet de kapitein toch te overtuigen omdat hij les heeft gehad van Yoko's vader .",^q_1_pos,0,
DACT/wik_part0830/2132536-5-1.xml,Grohl was het oneens met de release omdat hij voelde dat de band hun grootste hit nog niet had geschreven en liever wilde dat het album als de band gestopt was uitgebracht zou worden .,^q_1_pos,0,
DACT/wik_part0834/2151060-3-9.xml,"Als een voorzorgleider maakte Qusai wetten , zodat pelgrims die naar Mekka waren gekomen voorzien konden worden van voedsel en water die werd betaald door de belasting die zijn volk moest betalen .",^q_1_pos,0,
DACT/wik_part0842/2176918-3-4.xml,"Andere paddenstoelen waarmee "" A. deserticola "" zou kunnen worden verward omvatten de woestijnschimmelsoorten "" Podaxis pistillaris "" en "" Montagnea arenaria "" .",^q_1_pos,0,
DACT/wik_part0844/2184538-9-2.xml,"Wat de gebruiker volgens makers onder meer aantrekt is dat nu door iedereen , ongeacht zijn maatschappelijke positie , in een vertrouwde en uitdagende , levensechte leeromgeving elke rol die is geprogrammeerd kan worden gespeeld .",^q_1_pos,0,
DACT/wik_part0847/2193425-15-1.xml,De dieren die de egel onderweg tegenkomt zouden uitgelegd kunnen worden als aspecten die de eigen persoonlijkheid reflecteren .,^q_1_pos,0,
DACT/wik_part0847/2195151-7-6.xml,De grootste ingreep die hij heeft moeten laten plaatsvinden was het amputeren van zijn beide benen .,^q_1_pos,0,
DACT/wik_part0848/2197903-11-3.xml,"Het ministerie van Binnenlandse Zaken zou worden belast met het controleren van de informatie betreffende het verhuurrecht , of de huizen die schade hadden opgelopen vergoed zouden worden en of de schade in aanmerking kwam voor een vergoeding .",^q_1_pos,0,
DACT/wik_part0848/2199247-2-1.xml,"( Elektrisch ) booglassen omvat verschillende lasmethoden waarbij de voorwerpen die aaneen gelast moeten worden verhit worden door een elektrische plasmaboog , zodat het materiaal smelt en aaneen vloeit .",^q_1_pos,0,
DACT/wik_part0871/2285046-39-2.xml,"Of en tot welk bedrag op een dergelijke garantie zou moeten worden uitbetaald was echter , uiteraard , niet te zeggen .",^q_1_pos,0,
